source,content,headline,date_published
"{'id': None, 'name': 'Forbes'}","SUQIAN, CHINA - OCTOBER 23, 2024 - Illustration Huawei's native Harmony OS operating system, China's ... More first homegrown mobile operating system, is officially released.
CFOTO/Future Publishing… [+7359 chars]",When Empires Collide: The Strain Of Building HarmonyOS,2025-07-22T07:49:10Z
"{'id': None, 'name': 'Forbes'}","The term end user is outdatedif not downright dangerousin the age of AI. 
getty
I was first introduced to the limitations of end user thinking a decade ago when I managed the rollout of an oil &amp… [+6999 chars]",Why AI Is Ending The Era Of The End User,2025-07-22T12:16:21Z
"{'id': None, 'name': 'Forbes'}","Extreme heat, hurricanes, and wildfires have become a new variable in retirement planning.
getty
June 22 marked the start of summer, but in the Northeast, it felt less like a solstice and more like… [+7780 chars]","What’s Your Retirement Forecast? Heat, Hurricanes, And Wildfires Ahead",2025-06-23T17:20:45Z
"{'id': None, 'name': 'Forbes'}","AI Intelligence
Delphi Digital
When I was researching my book AI First, Human Always, I spent months combing through hundreds of sources on artificial intelligenceacademic papers, startup blogs, VC… [+6798 chars]",First Free AI Research Hub Launched By Crypto Giant Delphi,2025-07-16T12:15:00Z
"{'id': None, 'name': 'Forbes'}","To avoid being outnumbered or outranked by AI, you've got to use the same playbook that AI follows
getty
Your websites Google traffic isnt down because the algorithm hates you. Its down because SEO… [+6849 chars]",5 Hacks To Quickly Boost Your Google Traffic With AI In 2025,2025-07-21T11:45:00Z
"{'id': None, 'name': 'Forbes'}","Teen photographer who uses chatgpt to help with her business. 
getty
Teen entrepreneurs today have an advantage: ChatGPT prompts that can accelerate business development without requiring significa… [+7567 chars]",5 ChatGPT Prompts That Help Teens Build $100-A-Day Businesses,2025-06-26T16:49:02Z
"{'id': None, 'name': 'Forbes'}","Porn bans are more dangerous than you think.
getty
Republished on June 28 with U.S. Supreme Court ruling on porn restrictions. 
Theres a new warning for smartphone users. Free apps with hundreds o… [+5998 chars]",Porn Ban Warning For Millions Of iPhone And Android Users,2025-06-28T14:03:35Z
"{'id': None, 'name': 'Forbes'}","Photo credit
getty
We often think of summer as a season to cut down on our professional commitments while taking vacations and letting career development slide. Taking a break is absolutely essenti… [+6460 chars]",Why Summer Is The Smartest Season To Build Your Personal Brand,2025-07-09T10:00:00Z
"{'id': None, 'name': 'Forbes'}","Nude cyclists ride along The Mall during the World Naked Bike Ride in London. 
Wiktor Szymanowicz/Future Publishing via Getty Images
Celebrating its 20th year and throughout the summer, the World N… [+6678 chars]",World Naked Bike Ride: A Protest Against ‘Indecent Exposure’ To Car Culture,2025-07-20T13:00:00Z
"{'id': None, 'name': 'Forbes'}","The case against Jeffrey Epstein, the notorious financier connected to wealthy and powerful figures in politics and business, is back in the spotlight again as the Trump administration faces immense … [+8285 chars]",Here’s What Jeffrey Epstein Did—The Convictions And Allegations—And The Questions Raised Now,2025-07-20T21:26:46Z
"{'id': None, 'name': 'TheStreet'}","Veteran analyst drops jaw-dropping price target on AppLovin stock originally appeared on TheStreet.
Its safe to say that when most folks think of AI stocks, they typically picture shiny Nvidia or AM… [+4092 chars]",Veteran analyst drops jaw-dropping price target on AppLovin stock,2025-07-08T17:07:00Z
"{'id': 'usa-today', 'name': 'USA Today'}","The threat of floods continues to loom in Central Texas as the search for survivors and victims of the historic flash floods that swept through the state intensifies.
At least 70 people died during … [+2941 chars]",Flood threat still looms over battered Texas Hill Country: See flood warnings,2025-07-06T22:27:25Z
"{'id': None, 'name': 'Forbes'}","The English translation of the second 'Snowglobe' book was published in May 2025.
DELACORTE PRESS/PENGUIN RANDOM HOUSE
Snowglobe 2
, the second installment of the dystopian fantasy Snowglobe serie… [+6183 chars]",‘Snowglobe 2’ Publishes English Translation And Has Some K-Drama News,2025-07-03T12:10:21Z
"{'id': None, 'name': 'Forbes'}","FBI agents who went through the governments documents on financier Jeffrey Epstein were directed to flag any materials that mentioned President Donald Trump, Sen. Dick Durbin, D-Ill., alleged in lett… [+6529 chars]","FBI Agents Told To ‘Flag’ Epstein Files Mentioning Trump, Senator Claims",2025-07-18T18:25:34Z
"{'id': None, 'name': 'Forbes'}","Kim Min-ha plays a woman haunted by her memories in 'Girl With Closed Eyes.'
© 2024 SOLAIRE PARTNERS L@LC &amp; MIND2MIND PICTURES ALL RIGHTS RESERVED.
Mystery thrillers tend to ask a lot of questi… [+6125 chars]",Director Chun Sun-Young Wanted To Give Her Film’s Victim A Voice,2025-07-22T12:11:07Z
"{'id': 'nbc-news', 'name': 'NBC News'}","Senate Democratic Whip Dick Durbin, D-Ill., pressed Justice Department leadership about their handling of files related to the federal investigation into the late Jeffrey Epstein, including reports t… [+5475 chars]","FBI personnel were told to flag Epstein files mentioning Trump, Senate Democrat says",2025-07-19T00:56:26Z
"{'id': None, 'name': 'Forbes'}","(Left to right) John Leguizamo and Anna Chlumsky in 'Smoke.'
Apple TV+
Although John Leguizamo and Anna Chlumskys characters don't appear until halfway through Smoke's nine-episode run, they wouldn… [+7565 chars]",John Leguizamo And Anna Chlumsky On ‘Smoke’ And Her Hard No To ‘My Girl 3’,2025-06-27T16:00:37Z
"{'id': None, 'name': 'Forbes'}","Heres a number that should terrify every CEO: Daily AI usage has doubled in the past 12 months - from 4% to 8% of employees.
Yes, you read that correctly. After billions in investment and endless hy… [+8251 chars]",Your Boss Will Soon Grade You On AI Usage - Here’s Why,2025-06-30T16:53:02Z
"{'id': None, 'name': 'Forbes'}","Toninho Corrêa
Photo courtesy of Blis
While much of the world watches Germany and the U.S. inch forward on cannabis reform, Brazil has quietly become home to a fast-growing and highly structured me… [+10762 chars]",This Brazilian Startup Is Turning A Population Of 211 Million Into A Cannabis Data Goldmine,2025-07-03T13:30:00Z
"{'id': None, 'name': 'Forbes'}","Cuomo, seen here at a candidates forum in April, has led most polls for the Democratic nomination for mayor of New York. The primary is on Tuesday, June 24.
AP Photo/Frank Franklin II
In 2017, Andr… [+9596 chars]",Here’s How Much Andrew Cuomo Is Worth,2025-06-23T10:30:27Z
"{'id': None, 'name': 'Forbes'}","An artists rendering of MethaneSAT, a satellite designed to measure methane pollution around the ... More world.
MethaneSAT
When the $88 million MethaneSAT went dark over the Pacific Ocean on June … [+10136 chars]",Why MethaneSAT’s Sudden Silence Should Concern Us All,2025-07-11T12:32:39Z
"{'id': None, 'name': 'Forbes'}","Everyone Says They Want Lower Tuition. Then They Ask For A Climbing Wall
getty
Everyone Says They Want Lower Tuition. Then They Ask For A Climbing Wall.
Its that time of year againthe moment when … [+8538 chars]",Why College Tuition Keeps Climbing—And Who’s Really Driving It,2025-07-14T14:04:23Z
"{'id': None, 'name': 'Forbes'}","Fraud case news headline in newspaper
getty
I study fraud and cybercrime for a living. Then I became a case study.
I've spent years as part of the fraud-fighting community, publishing academic res… [+9994 chars]",The Long Tail Of Identity Theft: What I Learned After Being Doxxed,2025-07-16T11:24:33Z
"{'id': None, 'name': 'Forbes'}","Back in 2020, I wrote here on Forbes about Belkins decision to brick its NetCam product and abandon the customers who bought into it.
I asked at the time whether the brand could ever be trusted agai… [+8661 chars]","Smart Today, Scrap Tomorrow: How Belkin Has Broken The Promise Of IoT",2025-07-16T17:23:23Z
"{'id': None, 'name': 'Forbes'}","President Donald Trump directed Attorney General Pam Bondi on Thursday to release grand jury documents related to disgraced financier Jeffrey Epstein, but while Bondi vowed to ask the court Friday to… [+8567 chars]",Trump And Bondi Promised Epstein Grand Jury Docs—But It Doesn’t Mean Anything Will Be Released Today Or Ever,2025-07-18T15:42:13Z
